{
  "schema_version" : "chesstory.position-commentary.response.v6",
  "annotation_policy_revision" : "chesstory.verdict-threshold-policy.v2",
  "request_id" : "request-relocation-enables-recapture",
  "job_id" : "dddddddddddddddddddddddddddddddd",
  "engine_profile" : "sf18-smallnet-t2-h16-v1",
  "variant" : "standard",
  "current_fen" : "r3k3/3pq3/8/4P3/8/8/P7/K7 b q - 0 1",
  "focus" : {
    "kind" : "played_move",
    "played_move_uci" : "d7d5",
    "resulting_fen" : "r3k3/4q3/8/3pP3/8/8/P7/K7 w q d6 0 2"
  },
  "progress" : {
    "phase" : "completed",
    "legal_move_count" : 29,
    "root_candidate_lines_admitted" : 3,
    "selected_commentaries_completed" : 1,
    "physical_works_issued" : 1,
    "physical_reports_accepted" : 1
  },
  "result" : {
    "kind" : "selected_move_choices",
    "selected_move_reviews" : [ {
      "legal_move_index" : 6,
      "move_uci" : "a8b8",
      "selection" : {
        "roles" : [ "best" ],
        "root_rank" : 1
      },
      "line_insight" : {
        "endpoint" : {
          "kind" : "engine_search",
          "moves" : [ "a8b8" ],
          "win_percent_for_mover" : 67.6211637485054,
          "depth" : 16
        }
      }
    }, {
      "legal_move_index" : 9,
      "move_uci" : "d7d5",
      "selection" : {
        "roles" : [ "played" ],
        "root_rank" : 2
      },
      "commentary" : {
        "primary" : {
          "kind" : "move_verdict",
          "comparison_evidence_id" : "move-review:13ff7773dcf39d336e1ed5374e6c6db656c0bdad3af4ab73383e066864de18e1:1:d7d5:evidence:candidate-comparison:OTU6UGxheWVkVnNCZXN0fEJsYWNrfEJlc3RSZWZlcmVuY2U6MTphOGI4fFBsYXllZDoyOmQ3ZDV8LTB4MS4xOWYwNDk2NjE0YTljcDR8TWlzdGFrZXxFbmdpbmVCYWNrZWQ",
          "verdict_code" : "mistake",
          "verdict_confidence" : "engine_backed",
          "mover" : "black",
          "delta" : {
            "candidate_win_percent_delta_for_mover" : -17.621163748505396,
            "kind" : "engine_evaluation"
          },
          "reference_endpoint" : {
            "kind" : "engine_search",
            "moves" : [ "a8b8" ],
            "win_percent_for_mover" : 67.6211637485054,
            "depth" : 16
          },
          "played_endpoint" : {
            "kind" : "engine_search",
            "moves" : [ "d7d5", "e5d6", "e7d6" ],
            "win_percent_for_mover" : 50,
            "depth" : 16
          }
        },
        "occurrence_relations" : [ {
          "subject_occurrence" : {
            "occurrence_id" : "move-review:13ff7773dcf39d336e1ed5374e6c6db656c0bdad3af4ab73383e066864de18e1:1:d7d5:evidence:transition:MToxfDM1OnIzazMvM3BxMy84LzRQMy84LzgvUDcvSzcgYiBxIC0gMCAxfDQ6ZDdkNXwxOjJ8MzY6cjNrMy80cTMvOC8zcFAzLzgvOC9QNy9LNyB3IHEgZDYgMCAy",
            "line_owner_evidence_id" : "move-review:13ff7773dcf39d336e1ed5374e6c6db656c0bdad3af4ab73383e066864de18e1:1:d7d5:evidence:line:MTYxOm1vdmUtcmV2aWV3OjEzZmY3NzczZGNmMzlkMzM2ZTFlZDUzNzRlNmM2ZGI2NTZjMGJkYWQzYWY0YWI3MzM4M2UwNjY4NjRkZTE4ZTE6MTpkN2Q1OnBvc2l0aW9uOk5qcGlaV1p2Y21WOE1Ub3hmRE0xT25JemF6TXZNM0J4TXk4NEx6UlFNeTg0THpndlVEY3ZTemNnWWlCeElDMGdNQ0F4fDE6MXw1OkJsYWNrfDM1OnIzazMvM3BxMy84LzRQMy84LzgvUDcvSzcgYiBxIC0gMCAxfDQ6ZDdkNQ",
            "transition_evidence_id" : "move-review:13ff7773dcf39d336e1ed5374e6c6db656c0bdad3af4ab73383e066864de18e1:1:d7d5:evidence:transition:MToxfDM1OnIzazMvM3BxMy84LzRQMy84LzgvUDcvSzcgYiBxIC0gMCAxfDQ6ZDdkNXwxOjJ8MzY6cjNrMy80cTMvOC8zcFAzLzgvOC9QNy9LNyB3IHEgZDYgMCAy",
            "move_uci" : "d7d5",
            "root_provenance" : "observed_game_root",
            "line_id" : "move-review:13ff7773dcf39d336e1ed5374e6c6db656c0bdad3af4ab73383e066864de18e1:1:d7d5:line:MTYxOm1vdmUtcmV2aWV3OjEzZmY3NzczZGNmMzlkMzM2ZTFlZDUzNzRlNmM2ZGI2NTZjMGJkYWQzYWY0YWI3MzM4M2UwNjY4NjRkZTE4ZTE6MTpkN2Q1OnBvc2l0aW9uOk5qcGlaV1p2Y21WOE1Ub3hmRE0xT25JemF6TXZNM0J4TXk4NEx6UlFNeTg0THpndlVEY3ZTemNnWWlCeElDMGdNQ0F4fDE6MXw1OkJsYWNrfDM1OnIzazMvM3BxMy84LzRQMy84LzgvUDcvSzcgYiBxIC0gMCAxfDQ6ZDdkNQ",
            "start" : {
              "fen" : "r3k3/3pq3/8/4P3/8/8/P7/K7 b q - 0 1",
              "ply" : 1
            },
            "destination" : {
              "fen" : "r3k3/4q3/8/3pP3/8/8/P7/K7 w q d6 0 2",
              "ply" : 2
            }
          },
          "relation_kind" : "relocation_enables_recapture",
          "proof" : {
            "source_evidence_id" : "move-review:13ff7773dcf39d336e1ed5374e6c6db656c0bdad3af4ab73383e066864de18e1:1:d7d5:evidence:causal-proof:causal-proposition:relocation-enables-recapture:v1:6430d2f03b784da4fa0c032599abd6f095680dc09746285a62dfa2be86121078:e0dd9d5f269926d48e1b2fbee5dc10c9e797e4b28733b28f2028ec40f03ecda3:414af1bd9ec8d44e6eba961f84f43a509ec67a6741931179a94173b465673e4f:1058eecc3d61ff2b1f127346b9bee20cd690a0f4eedd7b48074deb79e573a46d:subject:move-review:13ff7773dcf39d336e1ed5374e6c6db656c0bdad3af4ab73383e066864de18e1:1:d7d5:evidence:transition:MToxfDM1OnIzazMvM3BxMy84LzRQMy84LzgvUDcvSzcgYiBxIC0gMCAxfDQ6ZDdkNXwxOjJ8MzY6cjNrMy80cTMvOC8zcFAzLzgvOC9QNy9LNyB3IHEgZDYgMCAy",
            "semantic_id" : "6430d2f03b784da4fa0c032599abd6f095680dc09746285a62dfa2be86121078",
            "occurrence_id" : "e0dd9d5f269926d48e1b2fbee5dc10c9e797e4b28733b28f2028ec40f03ecda3",
            "dependency_fingerprint" : "414af1bd9ec8d44e6eba961f84f43a509ec67a6741931179a94173b465673e4f",
            "relocated_responder_branch" : {
              "branch_id" : "8a9ad8c35142f67679b47daae6498df5582bba02d3906b923a8891ba4fe708a3",
              "line_id" : "move-review:13ff7773dcf39d336e1ed5374e6c6db656c0bdad3af4ab73383e066864de18e1:1:d7d5:line:MTYxOm1vdmUtcmV2aWV3OjEzZmY3NzczZGNmMzlkMzM2ZTFlZDUzNzRlNmM2ZGI2NTZjMGJkYWQzYWY0YWI3MzM4M2UwNjY4NjRkZTE4ZTE6MTpkN2Q1OnBvc2l0aW9uOk5qcGlaV1p2Y21WOE1Ub3hmRE0xT25JemF6TXZNM0J4TXk4NEx6UlFNeTg0THpndlVEY3ZTemNnWWlCeElDMGdNQ0F4fDE6MXw1OkJsYWNrfDM1OnIzazMvM3BxMy84LzRQMy84LzgvUDcvSzcgYiBxIC0gMCAxfDQ6ZThjOA",
              "line_owner_evidence_id" : "move-review:13ff7773dcf39d336e1ed5374e6c6db656c0bdad3af4ab73383e066864de18e1:1:d7d5:evidence:line:MTYxOm1vdmUtcmV2aWV3OjEzZmY3NzczZGNmMzlkMzM2ZTFlZDUzNzRlNmM2ZGI2NTZjMGJkYWQzYWY0YWI3MzM4M2UwNjY4NjRkZTE4ZTE6MTpkN2Q1OnBvc2l0aW9uOk5qcGlaV1p2Y21WOE1Ub3hmRE0xT25JemF6TXZNM0J4TXk4NEx6UlFNeTg0THpndlVEY3ZTemNnWWlCeElDMGdNQ0F4fDE6MXw1OkJsYWNrfDM1OnIzazMvM3BxMy84LzRQMy84LzgvUDcvSzcgYiBxIC0gMCAxfDQ6ZThjOA",
              "root_transition_evidence_id" : "move-review:13ff7773dcf39d336e1ed5374e6c6db656c0bdad3af4ab73383e066864de18e1:1:d7d5:evidence:transition:MToxfDM1OnIzazMvM3BxMy84LzRQMy84LzgvUDcvSzcgYiBxIC0gMCAxfDQ6ZThjOHwxOjJ8MzU6MmtyNC8zcHEzLzgvNFAzLzgvOC9QNy9LNyB3IC0gLSAxIDI",
              "branch_role" : "relocated_responder",
              "root_provenance" : "counterfactual_analyzed_root",
              "root_move" : "e8c8",
              "steps" : [ {
                "step_index" : 0,
                "provenance" : "certified_analysis_move",
                "ply" : 2,
                "move_uci" : "e8c8",
                "fen_before" : "r3k3/3pq3/8/4P3/8/8/P7/K7 b q - 0 1",
                "fen_after" : "2kr4/3pq3/8/4P3/8/8/P7/K7 w - - 1 2"
              }, {
                "step_index" : 1,
                "provenance" : "certified_analysis_move",
                "ply" : 3,
                "move_uci" : "a2a3",
                "fen_before" : "2kr4/3pq3/8/4P3/8/8/P7/K7 w - - 1 2",
                "fen_after" : "2kr4/3pq3/8/4P3/8/P7/8/K7 b - - 0 2"
              }, {
                "step_index" : 2,
                "provenance" : "certified_analysis_move",
                "ply" : 4,
                "move_uci" : "d7d5",
                "fen_before" : "2kr4/3pq3/8/4P3/8/P7/8/K7 b - - 0 2",
                "fen_after" : "2kr4/4q3/8/3pP3/8/P7/8/K7 w - d6 0 3"
              }, {
                "step_index" : 3,
                "provenance" : "certified_analysis_move",
                "ply" : 5,
                "move_uci" : "e5d6",
                "fen_before" : "2kr4/4q3/8/3pP3/8/P7/8/K7 w - d6 0 3",
                "fen_after" : "2kr4/4q3/3P4/8/8/P7/8/K7 b - - 0 3"
              }, {
                "step_index" : 4,
                "provenance" : "certified_analysis_move",
                "ply" : 6,
                "move_uci" : "d8d6",
                "fen_before" : "2kr4/4q3/3P4/8/8/P7/8/K7 b - - 0 3",
                "fen_after" : "2k5/4q3/3r4/8/8/P7/8/K7 w - - 0 4"
              } ]
            },
            "retained_responder_branch" : {
              "branch_id" : "dca4e1413392de600d385006fad6655975c42ab272c8a7c264fa086b967d43c8",
              "line_id" : "move-review:13ff7773dcf39d336e1ed5374e6c6db656c0bdad3af4ab73383e066864de18e1:1:d7d5:line:MTYxOm1vdmUtcmV2aWV3OjEzZmY3NzczZGNmMzlkMzM2ZTFlZDUzNzRlNmM2ZGI2NTZjMGJkYWQzYWY0YWI3MzM4M2UwNjY4NjRkZTE4ZTE6MTpkN2Q1OnBvc2l0aW9uOk5qcGlaV1p2Y21WOE1Ub3hmRE0xT25JemF6TXZNM0J4TXk4NEx6UlFNeTg0THpndlVEY3ZTemNnWWlCeElDMGdNQ0F4fDE6MXw1OkJsYWNrfDM1OnIzazMvM3BxMy84LzRQMy84LzgvUDcvSzcgYiBxIC0gMCAxfDQ6ZDdkNQ",
              "line_owner_evidence_id" : "move-review:13ff7773dcf39d336e1ed5374e6c6db656c0bdad3af4ab73383e066864de18e1:1:d7d5:evidence:line:MTYxOm1vdmUtcmV2aWV3OjEzZmY3NzczZGNmMzlkMzM2ZTFlZDUzNzRlNmM2ZGI2NTZjMGJkYWQzYWY0YWI3MzM4M2UwNjY4NjRkZTE4ZTE6MTpkN2Q1OnBvc2l0aW9uOk5qcGlaV1p2Y21WOE1Ub3hmRE0xT25JemF6TXZNM0J4TXk4NEx6UlFNeTg0THpndlVEY3ZTemNnWWlCeElDMGdNQ0F4fDE6MXw1OkJsYWNrfDM1OnIzazMvM3BxMy84LzRQMy84LzgvUDcvSzcgYiBxIC0gMCAxfDQ6ZDdkNQ",
              "root_transition_evidence_id" : "move-review:13ff7773dcf39d336e1ed5374e6c6db656c0bdad3af4ab73383e066864de18e1:1:d7d5:evidence:transition:MToxfDM1OnIzazMvM3BxMy84LzRQMy84LzgvUDcvSzcgYiBxIC0gMCAxfDQ6ZDdkNXwxOjJ8MzY6cjNrMy80cTMvOC8zcFAzLzgvOC9QNy9LNyB3IHEgZDYgMCAy",
              "branch_role" : "retained_responder",
              "root_provenance" : "observed_game_root",
              "root_move" : "d7d5",
              "steps" : [ {
                "step_index" : 0,
                "provenance" : "observed_game_move",
                "ply" : 2,
                "move_uci" : "d7d5",
                "fen_before" : "r3k3/3pq3/8/4P3/8/8/P7/K7 b q - 0 1",